{
  "schema_version": "0.5.0",
  "case_ref": "CASE-0001",
  "evidence_id": "EVIDENCE-0003",
  "evidence_type": "api_trace",
  "origin_ref": "MODEL:origin-alpha:v1",
  "derivative_ref": "MODEL:student-beta:v1",
  "method": "authenticated API gateway trace",
  "maturity": "established",
  "observation": {
    "request_observed": true,
    "response_observed": true,
    "authenticated_client": true,
    "request_id": "REQ-9918",
    "endpoint_class": "model-generation"
  },
  "statistic": null,
  "threshold": null,
  "calibration_ref": null,
  "source_event_ref": "EVENT:api-call-9918",
  "source_artifact_refs": [
    "ARTIFACT:api-gateway-log-9918"
  ],
  "assumptions": [
    "gateway timestamps are synchronized within the declared tolerance",
    "the authenticated client identity was correctly resolved"
  ],
  "limitations": [
    "the trace originates from the same event as EVIDENCE-0002",
    "the trace must not be counted as fully independent evidence",
    "API access does not prove downstream training use"
  ],
  "artifact_refs": [
    "ARTIFACT:api-gateway-log-9918",
    "ARTIFACT:request-metadata-9918"
  ],
  "collected_at": "2026-09-07T00:12:00Z",
  "collected_by": "AUDITOR:reference-node",
  "integrity": {
    "algorithm": "sha256",
    "digest": "cccccccccccccccccccccccccccccccccccccccccccccccccccccccccccccccc"
  },
  "challenge_status": "unchallenged"
}
